{
  "schemaVersion": "aico8.typography-manifest.v1",
  "manifestId": "aico8-latin-ui-v1",
  "osFallback": false,
  "assets": [
    {
      "id": "atkinson-regular",
      "family": "Aico Sans",
      "version": "1cb311624b2ddf88e9e37873999d165a8cd28b46",
      "face": {
        "weight": 400,
        "style": "normal"
      },
      "file": {
        "path": "fonts/AtkinsonHyperlegible-Regular.woff2",
        "sha256": "2df4ba17804bc7a36f123127966075d8427bff2df58d0d76820c1130bb1a4150",
        "format": "woff2"
      },
      "metrics": {
        "path": "fonts/AtkinsonHyperlegible-Regular.metrics.json",
        "sha256": "ae0352117c0d13975cdc63b37505668112eba90b80c76107a6fea56169e4129a",
        "schemaVersion": "aico8.glyph-metrics.v1"
      },
      "source": {
        "upstreamRevision": "1cb311624b2ddf88e9e37873999d165a8cd28b46",
        "provenancePath": "fonts/AtkinsonHyperlegible-PROVENANCE.txt",
        "provenanceSha256": "ff6970fa5cf9be00870e4918467d284e753cbdb9f19056b3d4342d40bf64d433"
      },
      "license": {
        "spdx": "OFL-1.1",
        "evidencePath": "fonts/OFL-Atkinson-Hyperlegible.txt",
        "evidenceSha256": "64b9cae8727cb41ea9e8843103e69647c82383f3a902e2bb39b2c5d92083b6e1"
      },
      "coverageCodePoints": [
        32,
        33,
        34,
        35,
        36,
        37,
        38,
        39,
        40,
        41,
        42,
        43,
        44,
        45,
        46,
        47,
        48,
        49,
        50,
        51,
        52,
        53,
        54,
        55,
        56,
        57,
        58,
        59,
        60,
        61,
        62,
        63,
        64,
        65,
        66,
        67,
        68,
        69,
        70,
        71,
        72,
        73,
        74,
        75,
        76,
        77,
        78,
        79,
        80,
        81,
        82,
        83,
        84,
        85,
        86,
        87,
        88,
        89,
        90,
        91,
        92,
        93,
        94,
        95,
        96,
        97,
        98,
        99,
        100,
        101,
        102,
        103,
        104,
        105,
        106,
        107,
        108,
        109,
        110,
        111,
        112,
        113,
        114,
        115,
        116,
        117,
        118,
        119,
        120,
        121,
        122,
        123,
        124,
        125,
        126
      ]
    },
    {
      "id": "atkinson-bold",
      "family": "Aico Sans",
      "version": "1cb311624b2ddf88e9e37873999d165a8cd28b46",
      "face": {
        "weight": 700,
        "style": "normal"
      },
      "file": {
        "path": "fonts/AtkinsonHyperlegible-Bold.woff2",
        "sha256": "da8fce41a04f8498fbf79076f92d304b12e70c76f71b143c5dcfb6536c93c075",
        "format": "woff2"
      },
      "metrics": {
        "path": "fonts/AtkinsonHyperlegible-Bold.metrics.json",
        "sha256": "96fefe2868deeddf674d84970ffe2f741969cc8c4747ebd23d6fd2f2ced90708",
        "schemaVersion": "aico8.glyph-metrics.v1"
      },
      "source": {
        "upstreamRevision": "1cb311624b2ddf88e9e37873999d165a8cd28b46",
        "provenancePath": "fonts/AtkinsonHyperlegible-PROVENANCE.txt",
        "provenanceSha256": "ff6970fa5cf9be00870e4918467d284e753cbdb9f19056b3d4342d40bf64d433"
      },
      "license": {
        "spdx": "OFL-1.1",
        "evidencePath": "fonts/OFL-Atkinson-Hyperlegible.txt",
        "evidenceSha256": "64b9cae8727cb41ea9e8843103e69647c82383f3a902e2bb39b2c5d92083b6e1"
      },
      "coverageCodePoints": [
        32,
        33,
        34,
        35,
        36,
        37,
        38,
        39,
        40,
        41,
        42,
        43,
        44,
        45,
        46,
        47,
        48,
        49,
        50,
        51,
        52,
        53,
        54,
        55,
        56,
        57,
        58,
        59,
        60,
        61,
        62,
        63,
        64,
        65,
        66,
        67,
        68,
        69,
        70,
        71,
        72,
        73,
        74,
        75,
        76,
        77,
        78,
        79,
        80,
        81,
        82,
        83,
        84,
        85,
        86,
        87,
        88,
        89,
        90,
        91,
        92,
        93,
        94,
        95,
        96,
        97,
        98,
        99,
        100,
        101,
        102,
        103,
        104,
        105,
        106,
        107,
        108,
        109,
        110,
        111,
        112,
        113,
        114,
        115,
        116,
        117,
        118,
        119,
        120,
        121,
        122,
        123,
        124,
        125,
        126
      ]
    }
  ],
  "roles": [
    {
      "role": "display",
      "renderer": "woff2-canvas",
      "fontAssetIds": [
        "atkinson-bold"
      ],
      "requiredCodePoints": [
        32,
        33,
        34,
        35,
        36,
        37,
        38,
        39,
        40,
        41,
        42,
        43,
        44,
        45,
        46,
        47,
        48,
        49,
        50,
        51,
        52,
        53,
        54,
        55,
        56,
        57,
        58,
        59,
        60,
        61,
        62,
        63,
        64,
        65,
        66,
        67,
        68,
        69,
        70,
        71,
        72,
        73,
        74,
        75,
        76,
        77,
        78,
        79,
        80,
        81,
        82,
        83,
        84,
        85,
        86,
        87,
        88,
        89,
        90,
        91,
        92,
        93,
        94,
        95,
        96,
        97,
        98,
        99,
        100,
        101,
        102,
        103,
        104,
        105,
        106,
        107,
        108,
        109,
        110,
        111,
        112,
        113,
        114,
        115,
        116,
        117,
        118,
        119,
        120,
        121,
        122,
        123,
        124,
        125,
        126
      ],
      "metrics": {
        "sizePx": 72,
        "weight": 700,
        "trackingPx": 1.5,
        "lineHeightPx": 88
      },
      "fit": {
        "minSizePx": 36,
        "accessibilityMinCssPx": 24,
        "overflow": "fail",
        "maxLines": 2
      },
      "osFallback": false
    },
    {
      "role": "menu",
      "renderer": "woff2-canvas",
      "fontAssetIds": [
        "atkinson-regular",
        "atkinson-bold"
      ],
      "requiredCodePoints": [
        32,
        33,
        34,
        35,
        36,
        37,
        38,
        39,
        40,
        41,
        42,
        43,
        44,
        45,
        46,
        47,
        48,
        49,
        50,
        51,
        52,
        53,
        54,
        55,
        56,
        57,
        58,
        59,
        60,
        61,
        62,
        63,
        64,
        65,
        66,
        67,
        68,
        69,
        70,
        71,
        72,
        73,
        74,
        75,
        76,
        77,
        78,
        79,
        80,
        81,
        82,
        83,
        84,
        85,
        86,
        87,
        88,
        89,
        90,
        91,
        92,
        93,
        94,
        95,
        96,
        97,
        98,
        99,
        100,
        101,
        102,
        103,
        104,
        105,
        106,
        107,
        108,
        109,
        110,
        111,
        112,
        113,
        114,
        115,
        116,
        117,
        118,
        119,
        120,
        121,
        122,
        123,
        124,
        125,
        126
      ],
      "metrics": {
        "sizePx": 32,
        "weight": 400,
        "trackingPx": 0.5,
        "lineHeightPx": 40
      },
      "fit": {
        "minSizePx": 24,
        "accessibilityMinCssPx": 16,
        "overflow": "fail",
        "maxLines": 1
      },
      "osFallback": false
    },
    {
      "role": "dialogue",
      "renderer": "woff2-canvas",
      "fontAssetIds": [
        "atkinson-regular"
      ],
      "requiredCodePoints": [
        32,
        33,
        34,
        35,
        36,
        37,
        38,
        39,
        40,
        41,
        42,
        43,
        44,
        45,
        46,
        47,
        48,
        49,
        50,
        51,
        52,
        53,
        54,
        55,
        56,
        57,
        58,
        59,
        60,
        61,
        62,
        63,
        64,
        65,
        66,
        67,
        68,
        69,
        70,
        71,
        72,
        73,
        74,
        75,
        76,
        77,
        78,
        79,
        80,
        81,
        82,
        83,
        84,
        85,
        86,
        87,
        88,
        89,
        90,
        91,
        92,
        93,
        94,
        95,
        96,
        97,
        98,
        99,
        100,
        101,
        102,
        103,
        104,
        105,
        106,
        107,
        108,
        109,
        110,
        111,
        112,
        113,
        114,
        115,
        116,
        117,
        118,
        119,
        120,
        121,
        122,
        123,
        124,
        125,
        126
      ],
      "metrics": {
        "sizePx": 28,
        "weight": 400,
        "trackingPx": 0,
        "lineHeightPx": 38
      },
      "fit": {
        "minSizePx": 22,
        "accessibilityMinCssPx": 16,
        "overflow": "wrap",
        "maxLines": 4
      },
      "osFallback": false
    },
    {
      "role": "hud-number",
      "renderer": "woff2-canvas",
      "fontAssetIds": [
        "atkinson-bold"
      ],
      "requiredCodePoints": [
        32,
        33,
        34,
        35,
        36,
        37,
        38,
        39,
        40,
        41,
        42,
        43,
        44,
        45,
        46,